{
  "$id": "https://vizion-lab.local/ontology/schema/vocabulary.schema.json",
  "$schema": "https://json-schema.org/draft/2020-12/schema",
  "type": "object",
  "required": ["schemaVersion", "ontologyVersion", "locale", "terms"],
  "additionalProperties": false,
  "properties": {
    "schemaVersion": { "const": "1.0" },
    "ontologyVersion": { "const": "v1" },
    "locale": { "const": "zh-CN" },
    "terms": {
      "type": "array",
      "minItems": 1,
      "items": {
        "type": "object",
        "required": ["id", "phrases", "kind", "resolution", "governance"],
        "additionalProperties": false,
        "properties": {
          "id": { "type": "string", "pattern": "^[a-z][a-z0-9_.-]+$" },
          "phrases": { "type": "array", "minItems": 1, "items": { "type": "string", "minLength": 1 } },
          "kind": { "enum": ["synonym", "alias", "enum_value", "value_pattern", "derived_business_rule", "ambiguity_trigger", "relative_time"] },
          "resolution": {
            "type": "object",
            "additionalProperties": false,
            "properties": {
              "entityId": { "type": "string" },
              "metricId": { "type": "string" },
              "dimensionId": { "type": "string" },
              "filterValue": {},
              "valuePattern": { "type": "string", "minLength": 1, "maxLength": 160 },
              "captureGroup": { "type": "integer", "minimum": 0, "maximum": 9 },
              "normalizer": { "enum": ["identity", "uppercase", "lowercase"] },
              "maxMatches": { "type": "integer", "minimum": 1, "maximum": 20 },
              "ruleId": { "type": "string" },
              "timePreset": { "type": "string" },
              "ambiguityCode": { "type": "string" }
            },
            "minProperties": 1
          },
          "governance": { "$ref": "common.schema.json#/$defs/governance" }
        }
      }
    }
  }
}
