{
  "schemaVersion": "1.0",
  "ontologyVersion": "v1",
  "locale": "zh-CN",
  "terms": [
    {
      "id": "team.dtsv",
      "phrases": [
        "DTSV",
        "DTSV China",
        "DTSV_China"
      ],
      "kind": "enum_value",
      "resolution": {
        "dimensionId": "org.problem_finder_team",
        "filterValue": "DTSV_China"
      },
      "governance": {
        "status": "approved",
        "owner": "Quality Analytics"
      }
    },
    {
      "id": "metric.defect_count",
      "phrases": [
        "缺陷数",
        "缺陷数量",
        "多少缺陷",
        "defect count"
      ],
      "kind": "synonym",
      "resolution": {
        "metricId": "defect.count",
        "entityId": "quality.defect"
      },
      "governance": {
        "status": "approved",
        "owner": "Quality Analytics"
      }
    },
    {
      "id": "metric.created_defects",
      "phrases": [
        "新增缺陷",
        "新建缺陷",
        "提交缺陷",
        "创建缺陷",
        "提票",
        "报票",
        "created defects"
      ],
      "kind": "synonym",
      "resolution": {
        "metricId": "defect.created_count",
        "entityId": "quality.defect"
      },
      "governance": {
        "status": "approved",
        "owner": "Quality Analytics"
      }
    },
    {
      "id": "metric.resolved_defects",
      "phrases": [
        "解决缺陷",
        "关闭缺陷",
        "resolved defects",
        "closed defects"
      ],
      "kind": "ambiguity_trigger",
      "resolution": {
        "metricId": "defect.resolved_count",
        "ambiguityCode": "RESOLVED_OUTCOME_DEFINITION_UNAPPROVED"
      },
      "governance": {
        "status": "draft",
        "owner": "Quality Governance",
        "decisionRef": "docs/main-agent-v2/metric-decisions.md"
      }
    },
    {
      "id": "metric.open_defects",
      "phrases": [
        "未解决缺陷",
        "未关闭缺陷",
        "open defects"
      ],
      "kind": "ambiguity_trigger",
      "resolution": {
        "metricId": "defect.open_count",
        "ambiguityCode": "OPEN_STATUS_DEFINITION_UNAPPROVED"
      },
      "governance": {
        "status": "draft",
        "owner": "Quality Governance",
        "decisionRef": "docs/main-agent-v2/metric-decisions.md"
      }
    },
    {
      "id": "metric.test_runs",
      "phrases": [
        "测试执行数",
        "测试运行数",
        "manual run count",
        "run count"
      ],
      "kind": "synonym",
      "resolution": {
        "metricId": "testing.run_count",
        "entityId": "testing.test_run"
      },
      "governance": {
        "status": "approved",
        "owner": "Testing Analytics"
      }
    },
    {
      "id": "metric.testcases",
      "phrases": [
        "测试用例数",
        "用例数量",
        "testcase count"
      ],
      "kind": "synonym",
      "resolution": {
        "metricId": "testing.testcase_count",
        "entityId": "testing.test_case"
      },
      "governance": {
        "status": "approved",
        "owner": "Testing Analytics"
      }
    },
    {
      "id": "metric.passed_runs",
      "phrases": [
        "通过的测试数",
        "通过执行数",
        "passed runs"
      ],
      "kind": "synonym",
      "resolution": {
        "metricId": "testing.passed_run_count",
        "entityId": "testing.test_run"
      },
      "governance": {
        "status": "approved",
        "owner": "Testing Analytics"
      }
    },
    {
      "id": "metric.failed_runs",
      "phrases": [
        "失败的测试数",
        "失败执行数",
        "失败 Run 数量",
        "失败 Run 数",
        "失败 Run",
        "failed runs",
        "failed run count"
      ],
      "kind": "synonym",
      "resolution": {
        "metricId": "testing.failed_run_count",
        "entityId": "testing.test_run"
      },
      "governance": {
        "status": "approved",
        "owner": "Testing Analytics"
      }
    },
    {
      "id": "metric.pass_rate",
      "phrases": [
        "通过率",
        "测试通过率",
        "pass rate"
      ],
      "kind": "ambiguity_trigger",
      "resolution": {
        "metricId": "testing.pass_rate",
        "ambiguityCode": "TEST_RUN_DENOMINATOR_UNAPPROVED"
      },
      "governance": {
        "status": "draft",
        "owner": "Testing Governance",
        "decisionRef": "docs/main-agent-v2/metric-decisions.md"
      }
    },
    {
      "id": "metric.fail_rate",
      "phrases": [
        "失败率",
        "测试失败率",
        "fail rate"
      ],
      "kind": "ambiguity_trigger",
      "resolution": {
        "metricId": "testing.fail_rate",
        "ambiguityCode": "TEST_RUN_DENOMINATOR_UNAPPROVED"
      },
      "governance": {
        "status": "draft",
        "owner": "Testing Governance",
        "decisionRef": "docs/main-agent-v2/metric-decisions.md"
      }
    },
    {
      "id": "metric.coverage_rate",
      "phrases": [
        "覆盖率",
        "需求覆盖率",
        "coverage rate"
      ],
      "kind": "ambiguity_trigger",
      "resolution": {
        "metricId": "testing.requirement_coverage_rate",
        "ambiguityCode": "COVERAGE_POPULATION_UNAPPROVED"
      },
      "governance": {
        "status": "draft",
        "owner": "Requirements Governance",
        "decisionRef": "docs/main-agent-v2/metric-decisions.md"
      }
    },
    {
      "id": "metric.defect_density",
      "phrases": [
        "缺陷密度",
        "defect density"
      ],
      "kind": "ambiguity_trigger",
      "resolution": {
        "metricId": "quality.defect_density",
        "ambiguityCode": "DEFECT_DENSITY_DENOMINATOR_REQUIRED"
      },
      "governance": {
        "status": "draft",
        "owner": "Quality Governance",
        "decisionRef": "docs/main-agent-v2/metric-decisions.md"
      }
    },
    {
      "id": "metric.long_runner",
      "phrases": [
        "长期未解决",
        "long runner",
        "老缺陷"
      ],
      "kind": "ambiguity_trigger",
      "resolution": {
        "metricId": "defect.long_runner_count",
        "ambiguityCode": "LONG_RUNNER_THRESHOLD_UNAPPROVED"
      },
      "governance": {
        "status": "draft",
        "owner": "Quality Governance",
        "decisionRef": "docs/main-agent-v2/metric-decisions.md"
      }
    },
    {
      "id": "metric.resolution_speed",
      "phrases": [
        "解决得快不快",
        "解决速度",
        "解决时长",
        "resolution speed",
        "time to resolve"
      ],
      "kind": "ambiguity_trigger",
      "resolution": {
        "metricId": "defect.age_days",
        "ambiguityCode": "DEFECT_AGE_RULE_UNAPPROVED"
      },
      "governance": {
        "status": "draft",
        "owner": "Quality Governance",
        "decisionRef": "docs/main-agent-v2/metric-decisions.md"
      }
    },
    {
      "id": "metric.discovery_efficiency",
      "phrases": [
        "发现效率",
        "缺陷发现效率",
        "discovery efficiency"
      ],
      "kind": "ambiguity_trigger",
      "resolution": {
        "metricId": "team.discovery_efficiency",
        "ambiguityCode": "DISCOVERY_EFFICIENCY_FORMULA_UNAPPROVED"
      },
      "governance": {
        "status": "draft",
        "owner": "Quality Governance",
        "decisionRef": "docs/main-agent-v2/metric-decisions.md"
      }
    },
    {
      "id": "dimension.ecu",
      "phrases": [
        "ECU",
        "模块",
        "module"
      ],
      "kind": "alias",
      "resolution": {
        "dimensionId": "product.ecu",
        "entityId": "product.ecu"
      },
      "governance": {
        "status": "approved",
        "owner": "Product Analytics"
      }
    },
    {
      "id": "dimension.pu",
      "phrases": [
        "PU",
        "product unit"
      ],
      "kind": "alias",
      "resolution": {
        "dimensionId": "product.pu",
        "entityId": "product.pu"
      },
      "governance": {
        "status": "approved",
        "owner": "Product Analytics"
      }
    },
    {
      "id": "dimension.pu_value",
      "phrases": [
        "PU",
        "product unit"
      ],
      "kind": "value_pattern",
      "resolution": {
        "dimensionId": "product.pu",
        "valuePattern": "\\b\\d{2}-\\d{2}\\b",
        "captureGroup": 0,
        "normalizer": "uppercase",
        "maxMatches": 10
      },
      "governance": {
        "status": "approved",
        "owner": "Product Analytics"
      }
    },
    {
      "id": "dimension.istep",
      "phrases": [
        "i-step",
        "istep",
        "集成版本"
      ],
      "kind": "alias",
      "resolution": {
        "dimensionId": "product.i_step",
        "entityId": "product.i_step"
      },
      "governance": {
        "status": "approved",
        "owner": "Product Analytics"
      }
    },
    {
      "id": "dimension.project",
      "phrases": [
        "项目",
        "project"
      ],
      "kind": "alias",
      "resolution": {
        "dimensionId": "product.project",
        "entityId": "product.project"
      },
      "governance": {
        "status": "approved",
        "owner": "Product Analytics"
      }
    },
    {
      "id": "project.idcevo",
      "phrases": [
        "IDCEVO"
      ],
      "kind": "enum_value",
      "resolution": {
        "dimensionId": "product.project",
        "filterValue": "IDCEVO"
      },
      "governance": {
        "status": "approved",
        "owner": "Product Analytics"
      }
    },
    {
      "id": "dimension.defect_status",
      "phrases": [
        "缺陷状态",
        "按状态",
        "状态统计",
        "defect status",
        "by status",
        "grouped by status"
      ],
      "kind": "alias",
      "resolution": {
        "dimensionId": "quality.status",
        "entityId": "quality.defect"
      },
      "governance": {
        "status": "approved",
        "owner": "Quality Analytics"
      }
    },
    {
      "id": "dimension.phase",
      "phrases": [
        "Phase",
        "阶段",
        "缺陷阶段"
      ],
      "kind": "alias",
      "resolution": {
        "dimensionId": "quality.phase",
        "entityId": "quality.defect"
      },
      "governance": {
        "status": "approved",
        "owner": "Quality Analytics"
      }
    },
    {